book_id,title,feedback,total_friend_reviews,avg_friend_rating,mike_rating
352441,Who Stole The Animal Poop? (Buck Wilder Adventures),4.6,14,4.6,5.0
354289,The Guardian,4.0,8,3.8,4.4
355948,20 lot little golden books assorted kids vintage mix newer board books,4.5,9,4.7,4.2
356378,The Berenstain Bears and the Spooky Old Tree,4.4,8,4.4,3.3
356519,Bizzy Bear: Zookeeper,4.0,7,3.3,2.4
357344,Pete the Cat's Train Trip (My First I Can Read),4.9,11,5.0,4.4
358107,The Audubon Society Field Guide to North American Birds: Western Region,3.8,4,4.6,3.5
359029,Cat Daddy: What the World's Most Incorrigible Cat Taught Me About Li,4.6,5,4.8,4.6
359375,Tickle Time!: A Boynton on Board Board Book,4.8,6,4.8,4.6
359920,The New Yorker Book of All-New Cat Cartoons (New Yorker Series),4.4,1,4.8,3.8
360034,Animal World. 9781407550879,4.4,5,4.7,3.6
363260,Peter Spier's Circus (A Picture Yearling Book),4.5,9,4.8,3.9
363620,Magic Tree House Books 1-28 Choose Brand New Latest Edition Flat $4.75 Shipping,4.8,15,4.9,5.0
363623,Goosebumps: Werewolf of Fever Swamp,4.9,8,2.7,3.9
363810,The Berenstain Bears and the Christmas Angel (Berenstain Bears/Living),4.0,6,2.5,3.2
364899,Amelia Sparklepaw's Party Problem (Magic Animal Friends: Special Edition),5.0,12,2.7,3.5
365594,Baby Einstein: First Words,4.7,7,5.0,4.6
368009,"Sweet Dreams, Roo (Winnie the Pooh)",4.7,8,4.7,4.5
368197,Franklin's Blanket,4.3,5,2.9,2.8
368518,"Rainforest Escape: My Island Animal, Exotic Flower and Tropical Plant Color Book",4.5,12,4.4,4.0
368547,Animal Crossing: New Leaf: Prima Official Game Guide (Prima Official Game),4.7,9,2.5,3.8
369756,Baby Bear Discovers the World (Wildlife Picture Books),3.9,2,3.9,3.2
370966,"Happy Halloween, Biscuit!",4.5,8,4.5,4.8
372024,PETE THE CAT GOES CAMPING [I CAN,4.7,13,4.9,4.9
373154,"Inside of a Dog: What Dogs See, Smell, and Know",4.5,11,2.7,3.4
373177,NEW LISTINGLot of 8 PIG THE PUG books,4.8,11,4.9,4.6
373215,Paw Patrol IM Ready To Read,3.7,6,4.2,3.6
373387,Duck on a Bike,4.9,6,5.0,4.1
373427,BUILD YOUR OWN LOT: A to Z Mysteries / Calendar Series - Ron Roy / Scholastic,4.4,5,4.6,3.6
373698,"I Love You, Little Pookie",4.7,9,3.1,4.0
373991,The Animal Farm Buttermilk Cookbook: Recipes and Reflections from a Small Vermo,4.9,9,5.0,4.9
374341,Amelia Sparklepaw's Party Problem (Magic Animal Friends: Special Edition),4.1,5,4.2,3.9
374701,Captain Cat by Inga Moore,4.2,1,4.4,4.1
375083,Dream Animals: A Bedtime Journey,4.4,9,4.5,3.9
375488,"I Need a Hug / Necesito Un Abrazo (Bilingual) by Blabey, Aaron",4.3,15,3.1,4.6
376413,"The Hummingbird Book: The Complete Guide to Attracting, Identifying, and",4.1,7,4.1,3.4
376728,Dot the fire dog,4.6,6,4.9,3.8
376874,There Was an Old Lady Who Swallowed a Fly!,4.6,11,4.6,3.7
377126,"Llama Llama Gives Thanks by Dewdney, Anna",3.9,6,4.0,3.4
377143,Pete the Cat Checks Out the Library,4.2,9,4.4,3.8
377195,Dog Man: From the Creator of Captain Underpants (Dog Man #1),4.7,12,4.9,4.9
377690,Farewell to Shady Glade,4.5,7,4.9,4.3
377864,WHAT IF YOU HAD AN ANIMAL TAIL?,4.2,2,2.8,2.5
380694,Dog Heaven,4.5,14,4.8,4.5
381948,Tacky the Penguin,4.1,6,4.2,3.6
383343,The Loop - Mass Market,4.1,4,3.2,2.5
383566,"Panda Bear, Panda Bear, What Do You See? Board Book",4.9,15,4.1,4.2
384512,"THE SUPER SIDE-QUEST TEST!: A BR , Flintham, Thomas",4.7,11,4.8,4.2
385641,"The Mitten, 20th Anniversary Edition",4.8,11,5.0,5.0
385991,"The Bad Guys in Open Wide and Say Arrrgh! [The Bad Guys #15] by Blabey, Aaron",4.2,4,4.2,3.7
386361,The Ember Stone: A Branches Book (The Last Firehawk #1),4.6,7,2.0,3.4
386438,Ponyella,4.2,3,4.0,2.9
386779,"Scaredy-Cat, Splat! (Splat the Cat)",4.3,8,4.6,4.6
386885,Dog's Colorful Day,4.3,9,4.8,4.8
387196,Purrmaids #4: Search for the Mermicorn,4.6,6,4.6,3.3
387299,The Miraculous Journey of Edward Tulane by Kate Dicamillo,4.3,12,4.6,4.1
387522,Noisy Animals [My First],4.2,5,4.1,3.9
388002,I Love You to the Moon and Back by Amelia Hepworth (English) Board Books Book,4.5,10,4.7,4.6
388067,"Chickens by Miller, Sara Swan",4.3,7,2.1,2.8
388483,Disaster on the Titanic (Ranger in Time #9),4.7,7,4.6,4.1
388814,Peterson Field Guide Coloring Books: Birds: A Coloring Book [With Sticker(s)],4.2,10,4.3,3.8
390884,Paw Patrol Phonics Childrens Step Reading Books Beginning Readers Lot 12,4.0,2,4.3,3.5
390914,Charmed Book Of Shadows With ORIGINAL PAGES In English - BIG Size Halloween,4.4,3,3.0,3.6
392198,National Geographic Readers: Adorable Animals (Level 2) [PREMIUM LEATHER BOUND],4.9,11,5.0,4.4
392377,Owl Babies,4.2,14,2.5,4.0
393096,Toot & Puddle,4.5,15,4.3,4.2
394018,Babar the King (Babar Books (Random House)),4.2,1,4.3,3.1
394183,"NEW LISTINGKitty's Magic: Star the Little Farm Cat by Moonheart, Ella",4.6,12,4.8,4.9
394705,The Pout-Pout Fish,4.8,9,4.9,4.8
394820,Arctic Freeze (Race the Wild #3),4.8,11,4.9,5.0
396366,Pete the Kitty's First Day of Preschool (Pete the Cat),4.9,8,5.0,4.0
396988,TODDLER BOARD BOOKS **BABIES LOVE**FINGER PUPPET**LIFT A FLAP** YOU CHOOSE!,4.7,11,4.8,4.3
399146,"Macca the Alpaca by Cosgrove, Matt",4.5,11,4.7,4.7
399287,"Draw 50 Animals: The Step-by-Step Way to Draw Elephants, Tigers, Dogs, Fi",4.4,10,4.3,4.2
400534,"Time for Bed, Pete the Kitty: A Touch & Feel Book (Pete the Cat)",4.4,6,4.5,3.5
400706,Blueberries for Sal (Viking Kestrel picture books),4.5,11,3.0,3.9
402476,"Pete the Cat Rocking in My School Shoes - Eric Litwin, 0545501067",4.3,8,4.4,3.7
402552,NEW LISTINGKaakuluk: Bearded Seals!,4.7,6,4.6,4.8
403129,The Babies and Doggies Book,4.0,5,3.7,4.0
403141,God Gave Us Easter,4.0,5,4.4,3.9
403296,Dog Man: Brawl of the Wild: From the Creator of Captain Underpants [Dog Man #6],4.7,5,4.7,4.6
